Book,Title,Goodreads,Sentiment,Status,MATTR
1,"Farewell, Nikola",15,0.23124,Neither,0.4894983302625518
2,A Child of the Jago,534,-0.041759,Canonical novels,0.5191713233701538
3,As Others Saw Him,0,0.123316,Neither,0.4536920279452579
4,As We Sweep Through The Deep,0,0.27737,Neither,0.5311667550036597
5,At a Winter's Fire,18,-0.140801,Neither,0.5359326302310278
6,At Aboukir and Acre A Story of Napoleon's Invasion of Egypt,0,0.132627,Neither,0.48305673959197065
7,At the Relton Arms,2,0.297092,Neither,0.5015200826131855
8,Athelstane Ford,1,-0.062959,Neither,0.5159851820278809
9,Audrey Craven,10,0.170015,Neither,0.5088931123810516
10,Averil,9,0.182786,Neither,0.5081520681447327
11,Aylwin,5,0.08158,Neither,0.48895401221713175
12,Babes in the Bush,0,0.389451,Neither,0.49848339806503256
13,Baboo Jabberjee B.A.,4,0.488777,Neither,0.5700232196727306
14,Beric the Briton A Story of the Roman Invasion,1080,0.063147,Neither,0.4856353391993506
15,Bert Lloyd's Boyhood A Story from Nova Scotia,0,0.502387,Neither,0.5139577461348704
16,Between Sun and Sand A Tale of an African Desert,2,-0.062542,Neither,0.5290592858667046
17,Beyond the City,1,0.27086,Neither,0.5052732443000051
18,Black Rock A Tale of the Selkirks,18,0.14054,Neither,0.5015933902972954
19,Blanche A Story for Girls,0,0.428278,Neither,0.49939478917044816
20,Blazing Arrow A Tale of the Frontier,1,0.038341,Neither,0.509684094436729
21,Blood Royal A Novel,3,0.305434,Neither,0.5330523842274186
22,Blue Jackets or The Log of the Teaser,3,-0.008531,Neither,0.49920198714202224
23,A Clerk of Oxford and His Adventures in the Baron's War,0,0.39592,Neither,0.5166880908635377
24,Bob Strong's Holidays Adrift in the Channel,0,0.304644,Neither,0.5438768687463214
25,Boris the Bear Hunter,0,0.18658,Neither,0.5115682125527007
26,Born in Exile,326,0.233969,Neither,0.5447037202203365
27,Both Sides the Border A Tale of Hotspur and Glendower,0,0.233548,Neither,0.48643826943918167
28,Bristol Bells A Story of the Eighteenth Century,1,0.138193,Neither,0.51675226024323
29,Brooke's Daughter A Novel,0,0.185626,Neither,0.4900400451167516
30,By Berwen Banks,0,0.323423,Neither,0.5104936061085633
31,By England's Aid  or The Freeing of the Netherlands (1585-1604),0,0.133747,Neither,0.48536904202388864
32,By Far Euphrates A Tale,17,0.038883,Neither,0.5187805634268142
33,By order of the company,0,-0.043176,Neither,0.5151543096537278
34,A Comedy of Masks,0,0.215449,Neither,0.5301969425521643
35,By Reef and Palm,24,0.013331,Neither,0.5146416408042099
36,"By Right of Conquest Or, With Cortez in Mexico",0,0.207387,Neither,0.49053141665064687
37,By Right of Sword,0,-0.005436,Neither,0.4868121022805222
38,Bye Ways,0,-0.040199,Neither,0.5102557365107446
39,Cæsar's Column A Story of the Twentieth Century,0,0.113452,Neither,0.5177879797937973
40,Capt'n Davy's Honeymoon,4,0.083293,Neither,0.4923861918748556
41,Casa Braccio,4,0.085107,Neither,0.48979783403167293
42,Catharine Furze,5,0.19489,Neither,0.49831497420803045
43,Catriona,1131,0.136059,Bestsellers,0.43451397874498976
44,Cecilia de Noël,0,0.11956,Neither,0.5149544
45,A Country Sweetheart,1,0.183872,Neither,0.47858758477101454
46,Celibates,10,0.127183,Neither,0.47517164218451774
47,Children of the Ghetto,89,0.217047,Neither,0.5358773729176437
48,Children of the Mist,21,0.074097,Neither,0.554302286846133
49,Clara Hopgood,15,0.215536,Neither,0.4594218157880691
50,Clarence,6,-0.017976,Neither,0.5189806916369791
51,Cleg Kelly Arab of the City,1,0.110982,Neither,0.5146423298614622
52,Clementina,17,0.047929,Neither,0.4805908918406072
53,Cleo The Magnificent Or The Muse of the Real,0,0.293708,Neither,0.5178459500816542
54,Clutterbuck's Treasure,0,0.129061,Neither,0.5041525249349833
55,Colonel Starbottle's Client,2,0.105446,Neither,0.5366645255256377
56,A Dash for a Throne,0,0.016573,Neither,0.48694768582581216
57,Colonel Thorndyke's Secret,0,0.235201,Neither,0.4656805281828932
58,Colonial Born A Tale of the Queensland bush,0,-0.054649,Neither,0.48633069156172387
59,Comedies of Courtship,0,0.273045,Neither,0.50837334040543
60,Condemned as a Nihilist A Story of Escape from Siberia,80,0.112024,Neither,0.47828057011740666
61,Corleone A Tale of Sicily,9,0.088959,Neither,0.4906022631531193
62,Cormorant Crag a Tale of the Smuggling Days,3,0.068455,Neither,0.49108200045055195
63,Count Hannibal A Romance of the Court of France,0,-0.230475,Neither,0.497268808406967
64,Cowmen and Rustlers A Story of the Wyoming Cattle Ranges,106,0.124706,Neither,0.5146918140437281
65,Crown and Anchor Under the Penant,1,0.268924,Neither,0.5403642887674068
66,Crusoes of the Frozen North,0,0.153801,Neither,0.5118953237159384
67,A Daughter of the Vine,8,0.140182,Neither,0.5261747431375556
68,Cursed by a Fortune,0,0.085329,Neither,0.48161464296757145
69,D Ri and I A Tale of Daring Deeds in the Second War with the British Being the Memoirs of Colonel Ramon Bell U.S.A.,17,0.113508,Neither,0.5109419529892382
70,Dariel A Romance of Surrey,0,0.357458,Neither,0.5182949391442336
71,Darkness and Dawn Or Scenes in the Days of Nero An Historic Tale,0,-0.10787,Neither,0.4958726117879737
72,Dead Men Tell No Tales,0,-0.073108,Neither,0.5070564837481908
73,Denzil Quarrier,17,0.237359,Neither,0.5408858676029333
74,Despair's Last Journey,0,0.107327,Neither,0.5067164915318719
75,Devil's Dice,2,0.025649,Neither,0.5383243029226856
76,Diana Tempest,26,0.030611,Neither,0.5084831523415037
77,Dodo A Detail of the Day,19,0.235914,Bestsellers,0.4794175241733317
78,A Daughter of To Day,0,0.360619,Neither,0.521228473487391
79,Dolly Dialogues,34,0.20572,Neither,0.47791007297181287
80,Domitia,1,0.048979,Neither,0.5170656169730127
81,Don Orsino,9,0.255548,Neither,0.499662698018326
82,Donald Ross of Heimra,1,0.152294,Neither,0.5051905223617964
83,Donna Teresa,0,0.080998,Neither,0.5238263319437446
84,Doom Castle,27,-0.017025,Neither,0.5241949002262489
85,Dorothy's Double,0,0.209429,Neither,0.4637901894331276
86,Dr. Rumsey's Patient,0,0.096053,Neither,0.4878873745611368
87,Dracula,897395,0.103137,Canonical novels,0.48763898168270725
88,Draw Swords In the Horse Artillery,9,0.143039,Neither,0.4896476839599023
89,A Deal with The Devil,8,0.159159,Neither,0.5118696180555555
90,Dream Days,235,0.29849,Neither,0.5347549648080797
91,Dream Life and Real Life A Little African Story  I.,19,0.141261,Neither,0.4498052516411379
92,Dreamers of the Ghetto,6,0.183184,Neither,0.5469840648768708
93,Drolls From Shadowland,0,0.019649,Neither,0.5058792886890989
94,Dwell Deep or Hilda Thorn's Life Story,18,0.270259,Neither,0.4890268998912936
95,Eben Holden A Tale of the North Country,45,0.155365,Neither,0.5111645490196078
96,Edward Barry South Sea Pearler,1,0.218872,Neither,0.5144154608290419
97,Eleanor,11,0.060914,Neither,0.5398009794386145
98,Eliza,17,0.231073,Neither,0.457594768242313
99,Elizabeth and Her German Garden,2718,0.432995,Bestsellers,0.5204910925001567
100,A Devotee An Episode in the Life of a Butterfly,6,0.10104,Neither,0.5097118710384224
101,Emily Fox Seton Being The Making of a Marchioness and The Methods of Lady Walderhurst,1431,0.35826,Neither,0.5085597174766688
102,Erewhon Revisited Twenty Years Later Both by the Original Discoverer of the Country and by His Son,133,0.311273,Neither,0.48168363383042284
103,Eric Brighteyes,476,-0.087898,Neither,0.4734590918070725
104,Esther's Charge A Story for Girls,0,0.303049,Neither,0.47762535955582314
105,Esther Waters,704,0.146386,Canonical novels,0.4849185240921094
106,Etidorhpa or The End of Earth The Strange History of a Mysterious Being and the Account of a Remarkable Journey,204,0.202808,Neither,0.509992829691345
107,Eve's Ransom,86,0.22224,Neither,0.5111029371991129
108,Evelyn Innes,7,0.306721,Neither,0.4826784475584623
109,Faith Gartney's Girlhood,0,0.353907,Neither,0.5264465533581854
110,Fan The Story of a Young Girl's Life,0,0.248439,Neither,0.4969645332921229
111,Tween Snow and Fire A Tale of the Last Kafir War,8,-0.183908,Neither,0.5476452399423695
112,A Digit of the Moon A Hindoo Love Story,181,0.131196,Neither,0.4657020078000867
113,Father Stafford,5,0.251834,Neither,0.49608497095010257
114,Fifteen Hundred Miles An Hour,3,0.302316,Neither,0.535556732261163
115,Final Proof Or The Value of Evidence,2,0.162598,Neither,0.4767248753257947
116,Fire Island,1,0.00719,Neither,0.5043446783428764
117,For Treasure Bound,0,0.489566,Neither,0.5101497943810293
118,Fordham's Feud,2,0.095689,Neither,0.5475751318323435
119,Frances Waldeaux A Novel,0,0.140156,Neither,0.5150478134915161
120,French and English A Story of the Struggle in America,0,-0.029008,Neither,0.5156512259897474
121,Friendship and Folly A Novel,3,0.206157,Neither,0.4928959264778937
122,From Kingdom to Colony,0,0.154325,Neither,0.5275641905808046
123,A Doctor of the Old School,6,0.048419,Neither,0.5187403622324419
124,From One Generation to Another,0,0.218674,Neither,0.5246165831059212
125,From the Memoirs of a Minister of France,0,-0.022944,Neither,0.4991254347706068
126,From Whose Bourne,7,0.123394,Neither,0.4526632576532352
127,Garthowen A Story of a Welsh Homestead,0,0.469029,Neither,0.5055240924412542
128,Gaston de Latour an unfinished romance,6,0.782791,Neither,0.5690010087067318
129,Ghetto Tragedies,13,0.062935,Neither,0.5402520496999409
130,Gil the Gunner The Youngest Officer in the East,1,0.015071,Neither,0.4892150409324268
131,Gilian The Dreamer His Fancy His Love and Adventure,6,0.050523,Neither,0.5013787173405948
132,Gold Gold in Cariboo A Story of Adventure in British Columbia,0,0.072745,Neither,0.50915964279745
133,Golden Face A Tale of the Wild West,2,-0.104959,Neither,0.5569146203007999
134,A Dog with a Bad Name,19,0.087627,Neither,0.5025785814484502
135,Good Luck,0,0.410324,Neither,0.4779831361986181
136,Grace O'Malley Princess and Pirate,1,-0.003073,Neither,0.4681094517796864
137,Green Fire A Romance,3,-0.002486,Neither,0.4943699497706923
138,Grey Roses,1,0.137957,Neither,0.5326072972285787
139,Grim Tales,126,0.079978,Neither,0.48888437124721223
140,Grisly Grisell Or The Laidly Lady of Whitburn A Tale of the Wars of the Roses,53,0.206536,Neither,0.49246175035868006
141,Guilty Bonds,3,-0.08138,Neither,0.5337776452660173
142,Half a Hero A Novel,4,0.183227,Neither,0.512575678793939
143,Heather and Snow,217,0.089632,Neither,0.4934527438618892
144,Helbeck of Bannisdale,31,0.046872,Bestsellers,0.5363032299522118
145,A Dozen Ways Of Love,4,0.226409,Neither,0.4927017867377707
146,Held Fast For England A Tale of the Siege of Gibraltar 1779-83,0,0.248522,Neither,0.474513457385635
147,Her Ladyship's Elephant,6,0.2297,Neither,0.5141050749553019
148,Her Majesty's Minister,2,0.206604,Neither,0.5288183784129284
149,Herb of Grace,14,0.379818,Neither,0.5167170670563018
150,Hilda Wade a Woman with Tenacity of Purpose,25,0.13237,Neither,0.5300540002488491
151,His Big Opportunity,12,0.307597,Neither,0.49248140563771964
152,His Grace of Osmonde Being the Portions of That Nobleman's Life Omitted in the Relation of His Lady's Story Presented to the World of Fashion under the Title of A Lady of Quality,63,0.379104,Neither,0.5146828780561424
153,His Lordship's Leopard A Truthful Narration of Some Impossible Facts,1,0.277044,Neither,0.5261935580652766
154,Hugh Wynne Free Quaker Sometime Brevet Lieutenant-Colonel on the Staff of his Excellency General Washington,0,0.166574,Neither,0.5104554126480807
155,Hunted and Harried,98,-0.105979,Neither,0.5500976229936204
156,A Duet with an Occasional Chorus,0,0.216616,Neither,0.42710818826563507
157,"I, Thou, and the Other One A Love Story",10,0.360888,Neither,0.5037121784493614
158,If Sinners Entice Thee,2,0.151547,Neither,0.5419636104174099
159,Imogen Only Eighteen,0,0.293197,Neither,0.5038579004484122
160,In a Hollow of the Hills,0,-0.021399,Neither,0.5169419599898709
161,In Connection with the De Willoughby Claim,0,0.251526,Neither,0.5079313398397306
162,In Direst Peril,1,0.18715,Neither,0.4849106026264536
163,In Far Bolivia A Story of a Strange Wild Land,0,0.135288,Neither,0.5370790112387342
164,In Greek Waters A Story of the Grecian War of Independence,0,0.223377,Neither,0.47934189950169476
165,In Homespun,0,0.250775,Neither,0.4451852297209279
166,In Honour's Cause A Tale of the Days of George the First,0,0.074655,Neither,0.4782269169103084
167,A Fascinating Traitor An Anglo Indian Story,1,0.161927,Neither,0.549889391703558
168,In Kedar's Tents,0,0.175786,Bestsellers,0.4636459173010897
169,In Search of Mademoiselle,2,0.047636,Neither,0.49209563822963437
170,In Strange Company A Story of Chili and the Southern Seas,3,0.113137,Neither,0.5185673115733391
171,In the Cage,717,0.33997,Neither,0.501152224824356
172,In the Day of Adversity,0,-0.029461,Neither,0.5078185568420093
173,In the Days of Drake,36,0.082355,Neither,0.504583649777585
174,In the Days of Chivalry  A Tale of the Times of the Black Prince,0,0.180981,Neither,0.5104760101834324
175,In the Fire of the Forge A Romance of Old Nuremberg,0,0.439865,Neither,0.5415309577272284
176,In the Fog,316,-0.004978,Neither,0.4716273099681384
177,In the Heart of the Rockies A Story of Adventure in Colorado,0,0.191624,Neither,0.4733250992724238
178,A First Family of Tasajara,0,0.241759,Neither,0.5304582355377606
179,In the Irish Brigade: A Tale of War in Flanders and Spain,0,0.223951,Neither,0.4851157583670151
180,In the Mahdi's Grasp,0,0.29339,Neither,0.49349040094257896
181,In the Midst of Alarms,7,0.196992,Neither,0.5000449692697265
182,In the Palace of the King A Love Story of Old Madrid,14,0.070778,Neither,0.4843075958345755
183,In the Quarter,10,0.073527,Neither,0.5344307988593016
184,In the Roar of the Sea,15,-0.031166,Neither,0.48702739994951905
185,In the Tideway,0,0.150843,Neither,0.537747515380975
186,In the Wars of the Roses A Story for the Young,0,0.39251,Neither,0.516499552190885
187,In the Year of Jubilee  Part,136,0.143833,Neither,0.5309765921963971
188,In the Yellow Sea,1,-0.001691,Neither,0.5228092358624418
189,"A Friend of Caesar  A Tale of the Fall of the Roman Republic  Time, 50-47 B.C.",25,0.001189,Neither,0.5474866690602519
190,In White Raiment,0,0.115688,Neither,0.5163320558622929
191,Into the Highways and Hedges,1,-0.006579,Neither,0.5126185707085096
192,Jack of Both Sides The Story of a School War,1,0.057193,Neither,0.5333487964136049
193,Jane Field  A Novel,0,0.148023,Neither,0.47397434469591504
194,Jennie Baxter Journalist,9,0.359134,Neither,0.4922328612974411
195,Jewel Mysteries from a Dealer's Note Book,26,0.192778,Neither,0.5078311030070773
196,Jill a Flower Girl,0,0.316922,Neither,0.4842764883248019
197,Joan of the Sword Hand,2,0.230407,Neither,0.5263833846933176
198,Joe Wilson and His Mates,32,-0.009397,Neither,0.4792673227075437
199,"John Ames, Native Commissioner",1,-0.083731,Neither,0.5350514096991185
200,A Gallant Grenadier A Tale of the Crimean War,15,0.041726,Neither,0.5238531297508097
201,John Burnet of Barns A Romance,71,0.099235,Neither,0.5137399025188316
202,"John Splendid  The Tale of a Poor Gentleman, and the Little Wars of Lorn",14,-0.0482,Neither,0.5240878257707382
203,Jude the Obscure,59811,0.190505,Canonical novels,0.5222712548944443
204,Jungle and Stream Or The Adventures of Two Boys in Siam,0,0.056701,Neither,0.48837778350515465
205,Kate Carnegie and Those Ministers,0,0.421716,Neither,0.5347150787984699
206,Khaled A Tale of Arabia,73,0.191659,Neither,0.46832649597754605
207,Kilgorman A Story of Ireland in 1798,4,-0.080157,Neither,0.5027527710085685
208,Kim,32366,0.104296,Both canonical and bestsellers,0.536661603471905
209,King of the Castle,2,0.084782,Neither,0.491651419448879
210,Klondike Nuggets and How Two Boys Secured Them,2,0.235264,Neither,0.5302114895780377
211,A Gentleman of France Being the Memoirs of Gaston de Bonne Sieur de Marsac,0,-0.039004,Neither,0.5122242481970336
212,Lancashire Idylls 1898,0,-0.009233,Neither,0.5228452649525548
213,Lawrence Clavering,6,0.007067,Neither,0.4893639401969703
214,Light Freights,0,0.059233,Neither,0.4794333146568719
215,Lilith A Romance,5442,-0.044354,Neither,0.49182254641626943
216,Little Miss Joy,1,0.285952,Neither,0.49580320108872517
217,Liza of Lambeth,1625,0.039701,Neither,0.4864656870660423
218,Lochinvar A Novel,4,0.109014,Neither,0.5271803681775534
219,London Pride Or When the World Was Younger,10,0.174088,Neither,0.5457333232338535
220,Lord Jim,26700,-0.053442,Canonical novels,0.5343233258859307
221,Lord Ormont and His Aminta,11,0.196894,Neither,0.5340793218398234
222,Captains Courageous A Story of the Grand Banks,19229,0.067948,Canonical novels,0.551536121252351
223,A Girl in Spring-Time,8,0.180758,Neither,0.5127367200986437
224,Lords of the World A story of the fall of Carthage and Corinth,12,0.212932,Neither,0.5076077285806501
225,Lost Man's Lane A Second Episode in the Life of Amelia Butterworth,0,0.139701,Neither,0.511406587502015
226,Love Among the Lions A Matrimonial Experience,0,0.25804,Neither,0.5223534343373855
227,Love and Mr. Lewisham,0,0.068028,Neither,0.5193083411433927
228,Lying Prophets A Novel,1,0.138535,Neither,0.5512048709004317
229,Lysbeth a Tale of the Dutch,251,0.054143,Neither,0.5193597611544203
230,Madelon  A Novel,0,0.055487,Neither,0.483345629247715
231,Mademoiselle Blanche,0,0.206936,Neither,0.4892670559363629
232,Maggie A Girl of the Streets,7129,-0.199213,Neither,0.5312006287385932
233,Mammon and Co.,0,0.303878,Neither,0.5069915056993376
234,A Girl of the Klondike,0,0.004314,Neither,0.5056409958539467
235,Many Cargoes,0,0.146636,Neither,0.4991024618659099
236,Maori and Settler A Story of The New Zealand War,0,0.239813,Neither,0.47913106045589693
237,Marcella,2,0.121576,Canonical novels,0.53179708370257
238,Marietta A Maid of Venice,23,0.167972,Neither,0.48499008291334744
239,Marion Darche A Story Without Comment,0,0.215056,Neither,0.4827290683638758
240,A Modern Wizard,3,0.131122,Neither,0.48628546552450497
241,Martin Hewitt Investigator,0,0.070233,Neither,0.49514308114464917
242,Mass George A Boy's Adventures in the Old Savannah,1,-0.026037,Neither,0.48928993972177065
243,Master of Men,0,0.117336,Neither,0.5203668177385119
244,Master Skylark A Story of Shakspere's Time,46,0.117634,Neither,0.5254350574712644
245,A Girl of the North A Story of London and Canada,0,0.139233,Neither,0.4120045097784138
246,Materfamilias,2,0.183552,Neither,0.5137104599013005
247,Menotah A Tale of the Riel Rebellion,0,-0.065888,Neither,0.5518068794216141
248,Michael's Crag,8,0.085722,Neither,0.5218987957321434
249,Miranda of the Balcony A Story,8,-0.009287,Neither,0.4862116630669546
250,Miss Cayley's Adventures,207,0.129665,Neither,0.5290606445429495
251,Miss Merivale's Mistake,0,0.197536,Neither,0.4739772554485555
252,Miss Mous and Her Boys,0,0.256189,Neither,0.4788887748117728
253,Miss Stuart's Legacy,2,0.043186,Neither,0.5397132907502933
254,Mollie's Prince A Novel,10,0.356703,Bestsellers,0.513898656701994
255,Monsieur Beaucaire,104,0.114363,Neither,0.521484047255485
256,A Gray Eye or So,0,0.322317,Neither,0.4780700662611646
257,Montezuma's Daughter,1654,-0.089048,Neither,0.4887561635077718
258,Moonfleet,4580,-0.135686,Neither,0.49248926315789476
259,More About Peggy,0,0.359279,Neither,0.5233356233167481
260,Mr.Marx's Secret,37,0.046719,Neither,0.513239872095722
261,Mr.Witt's Widow A Frivolous Tale,4,0.188869,Neither,0.5064997922941116
262,Mrs.Cliff's Yacht,3,0.571784,Neither,0.46373896437076495
263,My Brilliant Career,5488,0.221965,Neither,0.5224634909833277
264,My Danish Sweetheart A Novel,4,0.030056,Neither,0.5219274515122745
265,My Lady Rotha,12,-0.097215,Neither,0.5017018273547651
266,My Lord Duke,3,0.171926,Neither,0.5085988029779572
267,A Hero of Romance,2,0.096108,Neither,0.47543578342596643
268,Mysterious Mr. Sabin,30,0.165358,Neither,0.4987822763408756
269,Nada the Lily,306,-0.205395,Neither,0.4505771341923012
270,Nevermore,0,0.078034,Neither,0.5500907474196819
271,New Grub Street,5509,0.142329,Canonical novels,0.5168870214851512
272,News from Nowhere Or An Epoch of Rest Being Some Chapters from a Utopian Romance,1636,0.699198,Canonical novels,0.49098735904433344
273,No Surrender A Tale of the Rising in La Vendee,0,0.037122,Neither,0.48477635288116483
274,Noémi,1,-0.101158,Neither,0.5006830744330877
275,Nurse Elisia,1,0.129738,Neither,0.48271548432276734
276,Nurse Heatherdale's Story,0,0.325361,Neither,0.4796722511545642
277,Odd,20,0.209659,Neither,0.4900422524697041
278,A Honeymoon in Space,73,0.380544,Neither,0.5191692068911997
279,Olaf the Glorious A Story of the Viking Age,157,0.198531,Neither,0.4950988321069331
280,On the Face of the Waters A Tale of the Mutiny,31,0.004282,Neither,0.5369617204939512
281,On The Irrawaddy: A Story of the First Burmese War,0,0.13317,Neither,0.4782427331458825
282,One Man's View,2,0.180736,Neither,0.4997362250561828
283,One of Our Conquerors,6,0.227791,Neither,0.5457909932722623
284,Orientations,43,0.028192,Neither,0.4922456878248034
285,Our Bessie,21,0.355051,Neither,0.4961723691412247
286,Our Friend the Charlatan,19,0.343329,Neither,0.5322914005800063
287,Out with Garibaldi A story of the liberation of Italy,0,0.112658,Neither,0.4853773866492071
288,Pabo the Priest A Novel,1,-0.040108,Neither,0.5111431468122442
289,A Humble Enterprise,6,0.447988,Neither,0.5161132396003308
290,Parson Kelly,5,0.077999,Neither,0.494039743648016
291,Paul the Courageous,1,-0.029064,Neither,0.48595877665919174
292,Peccavi,0,0.056944,Neither,0.5042567557134033
293,Pembroke A Novel,0,0.022191,Neither,0.4739542263513097
294,Penelope's Experiences in Scotland Being Extracts from the Commonplace Book of Penelope Hamilton,30,0.448289,Bestsellers,0.549612631507153
295,Penelope's Irish Experiences,23,0.511771,Bestsellers,0.5539986398145706
296,Penshurst Castle in the Time of Sir Philip Sidney,2,0.322501,Neither,0.5170186814449709
297,Perlycross A Tale of the Western Hills,0,0.299429,Neither,0.5269961128986979
298,Perpetua A Tale of Nimes in A.D. 213,1,0.024232,Neither,0.5180821552023703
299,Peter Ibbetson,85,0.416163,Neither,0.5383724067199537
300,A Journey in Other Worlds A Romance of the Future,78,0.393359,Neither,0.5339756742934649
301,Pharais,8,-0.244389,Neither,0.522031035665295
302,Pharaoh's Broker Being the Very Remarkable Experiences in Another World of Isidor Werner,1,0.179459,Neither,0.5063562468054035
303,Pharos The Egyptian A Romance,47,0.129026,Neither,0.49776251277836797
304,Philippa,0,0.325698,Neither,0.5027649239172844
305,Phroso A Romance,33,0.011133,Neither,0.49259212782781037
306,Phyllis of Philistia,0,0.319296,Neither,0.4691862070544597
307,Pierre and His People Tales of the Far North,0,0.064916,Neither,0.49596020637056976
308,Pietro Ghisleri,2,0.212738,Neither,0.4958176932398967
309,Plain Living A Bush Idyll,0,0.476081,Neither,0.4928108504903366
310,Polly Oliver's Problem,34,0.484463,Neither,0.5242020101749597
311,A Knight of the Nets,2,0.175797,Neither,0.49248928488909427
312,Pomona's Travels A Series of Letters to the Mistress of Rudder Grange from her Former Handmaiden,9,0.498616,Neither,0.46041787224009295
313,Prairie Folks,9,0.059889,Neither,0.5288561519727228
314,Prince Ricardo of Pantouflia Being the Adventures of Prince Prigio's Son,10,0.300616,Neither,0.49175252156744925
315,Prince Zaleski,77,-0.094926,Neither,0.5291633072041807
316,Prisoners of Conscience,0,0.08113,Neither,0.49142316265874086
317,Prisoners of Hope,2,-0.063734,Neither,0.5257011874254192
318,Quisanté,4,0.291317,Neither,0.4975477604449835
319,Rabbi Saunderson,0,0.311933,Neither,0.5294176605028049
320,Ralph Denham's Adventures in Burma A Tale of the Burmese Jungle,0,0.07843,Neither,0.5307024353990396
321,Real Gold A Story of Adventure,3,0.073211,Neither,0.4871241923314356
322,A Knight of the White Cross A Tale of the Siege of Rhodes,0,0.30574,Neither,0.48587547804160536
323,Recalled to Life,13,-0.0235,Neither,0.49057906724916917
324,Red Pottage,152,0.044845,Neither,0.5025607067402713
325,Red Rowans,0,0.286901,Neither,0.53144384718756
326,Redskin and Cow Boy A Tale of the Western Plains,0,0.194869,Neither,0.4650185756500755
327,Reginald Cruden A Tale of City Life,6,0.184927,Neither,0.4996921248014179
328,Renshaw Fanning's Quest,7,-0.046249,Neither,0.5484405488418257
329,Revenge,32,0.035324,Neither,0.4949933633475226
330,Richard Carvel,50,0.122105,Bestsellers,0.5248518030292768
331,Robert Orange Being a Continuation of the History of Robert Orange,1,0.176066,Neither,0.5520226391297494
332,Robin Redbreast A Story for Girls,0,0.332286,Neither,0.48966895668228233
333,God Wills It A Tale of the First Crusade,56,0.025434,Neither,0.5504993548456181
334,A Little Norsk Or Ol' Paps' Flaxen,9,0.144651,Neither,0.5274107794552649
335,Roden's Corner,0,0.275102,Neither,0.5169533734550545
336,Rodney Stone,178,0.122274,Neither,0.4569450734983759
337,"Roger Ingleton, Minor",6,0.221383,Neither,0.51127052947936
338,Rose of Dutcher's Coolly,34,0.311237,Neither,0.517804872492853
339,Rujub the Juggler,0,0.175668,Neither,0.4730316932118561
340,Rupert of Hentzau From The Memoirs of Fritz Von Tarlenheim Sequel to The Prisoner of Zenda,1380,0.051417,Bestsellers,0.49244854271835414
341,Sail Ho A Boy at Sea,0,-0.041999,Neither,0.47785114998047395
342,Saint Bartholomew's Eve: A Tale of the Huguenot Wars,0,0.213656,Neither,0.4895339431607783
343,Salted with Fire,232,0.10547,Neither,0.5063827639308732
344,Samuel Boyd of Catchpole Square A Mystery,927,0.074892,Neither,0.48358205655303477
345,A Little Rebel,3,0.139584,Neither,0.4969930302715073
346,Sappers and Miners The Flood beneath the Sea,2,-0.005428,Neither,0.4750866500944986
347,Saronia A Romance of Ancient Ephesus,1,0.157492,Neither,0.5241677766948235
348,Savrola A Tale of the Revolution in Laurania,0,-0.007689,Neither,0.5307377172826296
349,Sawn Off A Tale of a Family Tree,0,0.067539,Neither,0.48556601365799823
350,Linnet,4,0.292494,Neither,0.5275718282615454
351,Sea Urchins,0,0.061227,Neither,0.4893816179757019
352,Senator North,3,0.263448,Neither,0.5132637715179968
353,Sentimental Tommy The Story of His Boyhood,62,0.025482,Bestsellers,0.4928344735135135
354,Settling Day,4,0.045515,Neither,0.47240345236080555
355,Seven Little Australians,0,0.059857,Neither,0.5254146319629389
